{
  "schemaVersion": "1.2",
  "id": "mlb-classic",
  "version": "1.2",
  "targetLogical": { "width": 128, "height": 32 },
  "parameters": {
    "layoutPreset": {
      "type": "choice",
      "default": "classic",
      "options": ["classic", "broadcast", "bigScore", "minimal", "detail", "broadcastRows", "broadcastLogos"]
    },
    "colors": {
      "background": { "type": "color", "default": "#000000" },
      "scoreColor": { "type": "color", "default": "#FFD700" },
      "teamText": { "type": "color", "default": "#FFFFFF" },
      "statusText": { "type": "color", "default": "#7FDBFF" },
      "favoriteAccent": { "type": "color", "default": "#E81828" },
      "useTeamColors": { "type": "toggle", "default": true }
    },
    "fonts": {
      "scoreFont": {
        "type": "choice",
        "options": ["4x6", "5x7", "6x10"],
        "default": "6x10"
      },
      "labelFont": {
        "type": "choice",
        "options": ["4x6", "5x7"],
        "default": "5x7"
      }
    },
    "elements": {
      "showBases": true,
      "showOuts": true,
      "showCount": false,
      "showProbables": true,
      "showClockWhenIdle": true
    },
    "transition": {
      "type": "choice",
      "default": "cut",
      "options": ["cut", "wipeLeft", "scrollUp"]
    }
  },
  "overlays": [
    {
      "type": "box",
      "x": 123,
      "y": 0,
      "width": 5,
      "height": 5,
      "color": "$colors.background",
      "filled": true,
      "when": "transportHeld == true"
    },
    {
      "type": "line",
      "x1": 124,
      "y1": 1,
      "x2": 124,
      "y2": 3,
      "color": "#FFB000",
      "when": "transportHeld == true"
    },
    {
      "type": "line",
      "x1": 126,
      "y1": 1,
      "x2": 126,
      "y2": 3,
      "color": "#FFB000",
      "when": "transportHeld == true"
    },
    {
      "type": "box",
      "x": 124,
      "y": 28,
      "width": 3,
      "height": 3,
      "color": "#FFB000",
      "filled": true,
      "when": "dataFreshness == 'stale'"
    },
    {
      "type": "line",
      "x1": 124,
      "y1": 28,
      "x2": 126,
      "y2": 30,
      "color": "#FF3333",
      "when": "dataFreshness == 'failed'"
    },
    {
      "type": "line",
      "x1": 126,
      "y1": 28,
      "x2": 124,
      "y2": 30,
      "color": "#FF3333",
      "when": "dataFreshness == 'failed'"
    }
  ],
  "teamColors": {
    "ATH": "#2E8B57",
    "ATL": "#CE1141",
    "BAL": "#FF8C00",
    "BOS": "#BD3039",
    "CHC": "#0E3386",
    "CLE": "#E31937",
    "COL": "#8A8D8F",
    "DET": "#FA4616",
    "KC": "#7AB2DD",
    "LAD": "#005A9C",
    "MIA": "#00A3E0",
    "MIN": "#D31145",
    "NYM": "#FF5910",
    "NYY": "#C4CED4",
    "PHI": "#E81828",
    "PIT": "#FDB827",
    "SD": "#FFC425",
    "SF": "#FD5A1E",
    "STL": "#C41E3A",
    "TEX": "#C0111F",
    "TOR": "#134A8E",
    "WSH": "#E31837"
  },
  "scenes": {
    "live": {
      "elements": [
        { "type": "box", "x": 0, "y": 0, "width": 128, "height": 32, "color": "$colors.favoriteAccent", "when": "isFavorite == true" },
        { "type": "sprite", "x": 1, "y": 0, "bind": "awayLogoAssetKey", "mode": "rgb", "when": "gameLogosAvailable == true" },
        { "type": "sprite", "x": 1, "y": 16, "bind": "homeLogoAssetKey", "mode": "rgb", "when": "gameLogosAvailable == true" },
        { "type": "text", "x": 2, "y": 5, "font": "$fonts.labelFont", "bind": "away.abbr", "color": "$colors.teamText", "when": "gameLogosAvailable == false" },
        { "type": "text", "x": 18, "y": 5, "font": "$fonts.labelFont", "bind": "away.abbr", "color": "$colors.teamText", "when": "gameLogosAvailable == true" },
        { "type": "text", "x": 25, "y": 3, "font": "$fonts.scoreFont", "bind": "away.score", "color": "$colors.scoreColor", "when": "gameLogosAvailable == false" },
        { "type": "text", "x": 61, "y": 3, "font": "$fonts.scoreFont", "bind": "away.score", "color": "$colors.scoreColor", "align": "right", "when": "gameLogosAvailable == true" },
        { "type": "line", "x1": 0, "y1": 15, "x2": 43, "y2": 15, "color": "$colors.statusText", "when": "gameLogosAvailable == false" },
        { "type": "line", "x1": 18, "y1": 15, "x2": 62, "y2": 15, "color": "$colors.statusText", "when": "gameLogosAvailable == true" },
        { "type": "line", "x1": 63, "y1": 1, "x2": 63, "y2": 30, "color": "$colors.statusText", "when": "gameLogosAvailable == true" },
        { "type": "line", "x1": 64, "y1": 1, "x2": 64, "y2": 30, "color": "$colors.statusText", "when": "gameLogosAvailable == true" },
        { "type": "text", "x": 2, "y": 21, "font": "$fonts.labelFont", "bind": "home.abbr", "color": "$colors.teamText", "when": "gameLogosAvailable == false" },
        { "type": "text", "x": 18, "y": 21, "font": "$fonts.labelFont", "bind": "home.abbr", "color": "$colors.teamText", "when": "gameLogosAvailable == true" },
        { "type": "text", "x": 25, "y": 19, "font": "$fonts.scoreFont", "bind": "home.score", "color": "$colors.scoreColor", "when": "gameLogosAvailable == false" },
        { "type": "text", "x": 61, "y": 19, "font": "$fonts.scoreFont", "bind": "home.score", "color": "$colors.scoreColor", "align": "right", "when": "gameLogosAvailable == true" },
        { "type": "text", "x": 50, "y": 3, "font": "5x7", "bind": "inningDisplay", "color": "$colors.statusText", "when": "gameLogosAvailable == false" },
        { "type": "text", "x": 69, "y": 3, "font": "5x7", "bind": "inningDisplay", "color": "$colors.statusText", "when": "gameLogosAvailable == true" },
        { "type": "countText", "x": 50, "y": 20, "font": "4x6", "bind": "count", "color": "$colors.statusText", "prefix": "B-S ", "when": "gameLogosAvailable == false", "visibleWhen": "$elements.showCount" },
        { "type": "countText", "x": 69, "y": 20, "font": "4x6", "bind": "count", "color": "$colors.statusText", "prefix": "B-S ", "when": "gameLogosAvailable == true", "visibleWhen": "$elements.showCount" },
        { "type": "basesDiamond", "x": 83, "y": 5, "bind": "bases", "color": "$colors.teamText", "occupiedColor": "$colors.scoreColor", "size": 4, "when": "gameLogosAvailable == false", "visibleWhen": "$elements.showBases" },
        { "type": "basesDiamond", "x": 96, "y": 2, "bind": "bases", "color": "$colors.teamText", "occupiedColor": "$colors.scoreColor", "size": 4, "when": "gameLogosAvailable == true", "visibleWhen": "$elements.showBases" },
        { "type": "outsDots", "x": 83, "y": 24, "bind": "outs", "color": "$colors.teamText", "activeColor": "$colors.favoriteAccent", "spacing": 6, "when": "gameLogosAvailable == false", "visibleWhen": "$elements.showOuts" },
        { "type": "outsDots", "x": 99, "y": 24, "bind": "outs", "color": "$colors.teamText", "activeColor": "$colors.favoriteAccent", "spacing": 7, "when": "gameLogosAvailable == true", "visibleWhen": "$elements.showOuts" },
        { "type": "text", "x": 118, "y": 2, "font": "4x6", "bind": "gameNumberDisplay", "color": "$colors.statusText", "when": "doubleheader == true" }
      ]
    },
    "pregame": {
      "elements": [
        { "type": "box", "x": 0, "y": 0, "width": 128, "height": 32, "color": "$colors.favoriteAccent", "when": "isFavorite == true" },
        { "type": "sprite", "x": 1, "y": 0, "bind": "awayLogoAssetKey", "mode": "rgb", "when": "gameLogosAvailable == true" },
        { "type": "sprite", "x": 48, "y": 0, "bind": "homeLogoAssetKey", "mode": "rgb", "when": "gameLogosAvailable == true" },
        { "type": "text", "x": 2, "y": 3, "font": "$fonts.labelFont", "bind": "away.abbr", "color": "$colors.teamText", "when": "gameLogosAvailable == false" },
        { "type": "text", "x": 24, "y": 3, "font": "4x6", "text": "AT", "color": "$colors.statusText", "when": "gameLogosAvailable == false" },
        { "type": "text", "x": 35, "y": 3, "font": "$fonts.labelFont", "bind": "home.abbr", "color": "$colors.teamText", "when": "gameLogosAvailable == false" },
        { "type": "text", "x": 66, "y": 3, "font": "5x7", "bind": "startTimeDisplay", "color": "$colors.scoreColor", "when": "gameLogosAvailable == false" },
        { "type": "text", "x": 18, "y": 4, "font": "4x6", "bind": "away.abbr", "color": "$colors.teamText", "when": "gameLogosAvailable == true" },
        { "type": "text", "x": 36, "y": 4, "font": "4x6", "text": "AT", "color": "$colors.statusText", "when": "gameLogosAvailable == true" },
        { "type": "text", "x": 65, "y": 4, "font": "4x6", "bind": "home.abbr", "color": "$colors.teamText", "when": "gameLogosAvailable == true" },
        { "type": "text", "x": 86, "y": 4, "font": "4x6", "bind": "startTimeDisplay", "color": "$colors.scoreColor", "when": "gameLogosAvailable == true" },
        { "type": "scrollText", "x": 2, "y": 19, "width": 124, "font": "4x6", "bind": "probableDisplay", "color": "$colors.statusText", "speedPxPerSec": 5, "visibleWhen": "$elements.showProbables" },
        { "type": "text", "x": 108, "y": 2, "font": "4x6", "bind": "gameNumberDisplay", "color": "$colors.statusText", "when": "doubleheader == true" }
      ]
    },
    "final": {
      "elements": [
        { "type": "box", "x": 0, "y": 0, "width": 128, "height": 32, "color": "$colors.favoriteAccent", "when": "isFavorite == true" },
        { "type": "sprite", "x": 1, "y": 0, "bind": "awayLogoAssetKey", "mode": "rgb", "when": "gameLogosAvailable == true" },
        { "type": "sprite", "x": 1, "y": 16, "bind": "homeLogoAssetKey", "mode": "rgb", "when": "gameLogosAvailable == true" },
        { "type": "text", "x": 2, "y": 5, "font": "$fonts.labelFont", "bind": "away.abbr", "color": "$colors.teamText", "when": "gameLogosAvailable == false" },
        { "type": "text", "x": 18, "y": 5, "font": "$fonts.labelFont", "bind": "away.abbr", "color": "$colors.teamText", "when": "gameLogosAvailable == true" },
        { "type": "text", "x": 25, "y": 3, "font": "$fonts.scoreFont", "bind": "away.score", "color": "$colors.scoreColor", "when": "gameLogosAvailable == false" },